{
  "$id": "https://agent-os-governance/schemas/tangent.schema.json",
  "$schema": "https://json-schema.org/draft/2020-12/schema",
  "title": "Tangent",
  "description": "Schema defining the structure of a tangent artifact within the Agent OS. Tangents represent deferred implementation tasks with dependencies, trigger conditions, and governance references.",
  "type": "object",
  "properties": {
    "id": {
      "type": "string",
      "description": "Unique identifier for this tangent (e.g., history-query-layer-001)."
    },
    "title": {
      "type": "string",
      "description": "Human-readable title of the tangent."
    },
    "description": {
      "type": "string",
      "description": "Detailed explanation of what this tangent represents and why it was deferred."
    },
    "status": {
      "type": "string",
      "description": "Current lifecycle state of the tangent.",
      "enum": [
        "deferred",
        "queued",
        "in_progress",
        "completed",
        "abandoned",
        "merged"
      ]
    },
    "priority": {
      "type": "string",
      "description": "Priority level for implementation.",
      "enum": [
        "low",
        "medium",
        "high",
        "critical"
      ]
    },
    "reason": {
      "type": "string",
      "description": "Explanation for why this tangent was deferred or what conditions must be met."
    },
    "dependencies": {
      "type": "array",
      "items": {
        "type": "string"
      },
      "description": "List of tangent IDs, system names, or artifact IDs that must be completed first."
    },
    "governance_reference": {
      "type": "array",
      "items": {
        "type": "string"
      },
      "description": "List of constitution file paths that this tangent relates to."
    },
    "expected_benefits": {
      "type": "array",
      "items": {
        "type": "string"
      },
      "description": "List of benefits or outcomes expected when this tangent is implemented."
    },
    "trigger_conditions": {
      "type": "array",
      "items": {
        "type": "string"
      },
      "description": "Conditions that must be met before this tangent can be activated."
    },
    "related_governance": {
      "type": "array",
      "items": {
        "type": "string"
      },
      "description": "Additional governance files that relate to this tangent."
    },
    "related_tangents": {
      "type": "array",
      "items": {
        "type": "string"
      },
      "description": "Other tangent IDs that are related or complementary."
    },
    "created_at": {
      "type": "string",
      "format": "date-time",
      "description": "ISO 8601 timestamp when this tangent was created."
    },
    "updated_at": {
      "type": "string",
      "format": "date-time",
      "description": "ISO 8601 timestamp when this tangent was last modified."
    }
  },
  "required": [
    "id",
    "title",
    "description",
    "status",
    "priority",
    "reason",
    "dependencies",
    "governance_reference",
    "expected_benefits",
    "trigger_conditions",
    "related_governance",
    "created_at"
  ],
  "additionalProperties": false
}
