{
  "id": "event-monitor-and-historian-001",
  "title": "Implement Event Monitor and Historian System",
  "description": "Implement a real-time event monitor and narrative historian capable of recording all system events and reconstructing histories on demand.",
  "status": "deferred",
  "priority": "high",
  "reason": "Essential for system cognition, history reconstruction, and SSOT integrity, but requires orchestrator maturity and event pipeline stability.",
  "dependencies": [
    "event-schema",
    "event-db",
    "orchestrator",
    "tree-brain-visualization",
    "intelligence-consolidation",
    "agent-capability-profiles"
  ],
  "governance_reference": [
    "constitution/event-governance.md",
    "constitution/historian-governance.md"
  ],
  "expected_benefits": [
    "complete chronological SSOT",
    "narrative reconstruction",
    "context-aware histories",
    "multi-process visibility",
    "organism self-awareness",
    "automatic changelogs"
  ],
  "trigger_conditions": [
    "orchestrator reaches Stage 3 maturity",
    "event pipeline operational",
    "tree-brain visualization implemented"
  ],
  "created_at": "2026-06-14T12:20:00-04:00",
  "related_governance": [
    "constitution/event-governance.md",
    "constitution/historian-governance.md",
    "constitution/foundation-governance.md",
    "constitution/eventlog-governance.md"
  ]
}
